{
  "meta": {
    "runId": "run-2026-02-27-14-42-59",
    "baseSha": "bb80406b1619aeb8a90d60c947f5f5c9a0ad6c29",
    "schemaVersion": "1.0.0",
    "thresholds": {
      "ok": 0.8,
      "warn": 0.65
    },
    "provenance": {
      "promptId": "reasoner.v1",
      "model": "gpt-5.1",
      "generatedAt": "2026-02-27T14:50:15.618Z"
    },
    "telemetry": {
      "latencyMs": 246416.32724200012,
      "tokens": {
        "prompt": 87989,
        "completion": 12577,
        "total": 100566
      },
      "retries": 0
    },
    "passTelemetry": {
      "extractor": {
        "promptTokens": 47882,
        "completionTokens": 4561,
        "latencyMs": 146012.199132
      },
      "reasoner": {
        "promptTokens": 33427,
        "completionTokens": 2463,
        "latencyMs": 15733.503544999985
      },
      "verifier": {
        "promptTokens": 1130,
        "completionTokens": 297,
        "latencyMs": 3739.028091000044
      },
      "notes": {
        "promptTokens": 5550,
        "completionTokens": 5256,
        "latencyMs": 80931.59647400008
      }
    }
  },
  "facts": [
    {
      "jsonPath": "$.business.userPopulations",
      "jsonPointer": "/business/userPopulations",
      "currentValue": [
        "Data Scientist",
        "ML Engineer",
        "Product Manager",
        "Governance, Compliance & Ethics Officer",
        "Data Engineer",
        "Software Developer",
        "UX Researcher",
        "Project Manager",
        "Domain Expert"
      ],
      "proposedValue": [
        "Data Scientist",
        "ML Engineer",
        "Product Manager",
        "Governance, Compliance & Ethics Officer",
        "Data Engineer",
        "Software Developer",
        "UX Researcher",
        "Project Manager",
        "Domain Expert"
      ],
      "source": {
        "kind": "extracted"
      },
      "repoSources": [
        {
          "path": "docs/stakeholders.yaml",
          "startLine": 2,
          "endLine": 2,
          "commit": "4bf797adb84dcc31f23bc853dc0b1e3072c76c85",
          "kind": "config"
        }
      ],
      "confidence": 0.1,
      "gate": "Require",
      "verifierNotes": "The provided snippet only shows `title: Data Scientist` and does not list or reference the full array of user populations claimed in the fact."
    },
    {
      "jsonPath": "$.meta.title",
      "jsonPointer": "/meta/title",
      "currentValue": "ML System Card (GitHub-native, PR-first)",
      "proposedValue": "ML System Card (GitHub-native, PR-first)",
      "source": {
        "kind": "extracted"
      },
      "repoSources": [
        {
          "path": "README.md",
          "startLine": 16,
          "endLine": 16,
          "commit": "4bf797adb84dcc31f23bc853dc0b1e3072c76c85",
          "kind": "docs"
        }
      ],
      "confidence": 0.1,
      "gate": "Require",
      "verifierNotes": "The README snippet only contains the heading `# Infinity ♾️` and does not mention `ML System Card (GitHub-native, PR-first)` as a title."
    },
    {
      "jsonPath": "$.provenance.changelog[1]",
      "jsonPointer": "/provenance/changelog/1",
      "proposedValue": {
        "date": "2026-02-27T14:44:08.469Z",
        "summary": "ML System Card run run-2026-02-27-14-42-59 observed 8 changed files",
        "files": [
          {
            "path": "libs/infinity_emb/Docker.template.yaml"
          },
          {
            "path": "libs/infinity_emb/Dockerfile.cpu_auto"
          },
          {
            "path": "libs/infinity_emb/Dockerfile.intel_auto"
          },
          {
            "path": "libs/infinity_emb/infinity_emb/_optional_imports.py"
          },
          {
            "path": "libs/infinity_emb/infinity_emb/primitives.py"
          },
          {
            "path": "libs/infinity_emb/infinity_emb/transformer/embedder/optimum.py"
          },
          {
            "path": "libs/infinity_emb/infinity_emb/transformer/utils_optimum.py"
          },
          {
            "path": "libs/infinity_emb/tests/unit_test/transformer/embedder/test_optimum.py"
          }
        ],
        "runId": "run-2026-02-27-14-42-59",
        "headSha": "4bf797adb84dcc31f23bc853dc0b1e3072c76c85"
      },
      "source": {
        "kind": "extracted"
      },
      "repoSources": [
        {
          "path": "libs/infinity_emb/Docker.template.yaml",
          "startLine": 1,
          "endLine": 1,
          "commit": "4bf797adb84dcc31f23bc853dc0b1e3072c76c85",
          "kind": "code"
        },
        {
          "path": "libs/infinity_emb/Dockerfile.cpu_auto",
          "startLine": 1,
          "endLine": 1,
          "commit": "4bf797adb84dcc31f23bc853dc0b1e3072c76c85",
          "kind": "code"
        },
        {
          "path": "libs/infinity_emb/Dockerfile.intel_auto",
          "startLine": 1,
          "endLine": 1,
          "commit": "4bf797adb84dcc31f23bc853dc0b1e3072c76c85",
          "kind": "code"
        },
        {
          "path": "libs/infinity_emb/infinity_emb/_optional_imports.py",
          "startLine": 1,
          "endLine": 1,
          "commit": "4bf797adb84dcc31f23bc853dc0b1e3072c76c85",
          "kind": "code"
        },
        {
          "path": "libs/infinity_emb/infinity_emb/primitives.py",
          "startLine": 1,
          "endLine": 1,
          "commit": "4bf797adb84dcc31f23bc853dc0b1e3072c76c85",
          "kind": "code"
        },
        {
          "path": "libs/infinity_emb/infinity_emb/transformer/embedder/optimum.py",
          "startLine": 1,
          "endLine": 1,
          "commit": "4bf797adb84dcc31f23bc853dc0b1e3072c76c85",
          "kind": "code"
        },
        {
          "path": "libs/infinity_emb/infinity_emb/transformer/utils_optimum.py",
          "startLine": 1,
          "endLine": 1,
          "commit": "4bf797adb84dcc31f23bc853dc0b1e3072c76c85",
          "kind": "code"
        },
        {
          "path": "libs/infinity_emb/tests/unit_test/transformer/embedder/test_optimum.py",
          "startLine": 1,
          "endLine": 1,
          "commit": "4bf797adb84dcc31f23bc853dc0b1e3072c76c85",
          "kind": "code"
        }
      ],
      "confidence": 0.1,
      "gate": "Require",
      "verifierNotes": "The Docker-related snippets only contain comments about command usage and autogenerated warnings; they do not contain any changelog structure, dates, run IDs, SHAs, or file lists as described in the fact."
    }
  ],
  "patch": [
    {
      "op": "add",
      "path": "/provenance/changelog/-",
      "value": {
        "date": "2026-02-27T14:44:08.469Z",
        "summary": "ML System Card run run-2026-02-27-14-42-59 observed 8 changed files",
        "files": [
          {
            "path": "libs/infinity_emb/Docker.template.yaml"
          },
          {
            "path": "libs/infinity_emb/Dockerfile.cpu_auto"
          },
          {
            "path": "libs/infinity_emb/Dockerfile.intel_auto"
          },
          {
            "path": "libs/infinity_emb/infinity_emb/_optional_imports.py"
          },
          {
            "path": "libs/infinity_emb/infinity_emb/primitives.py"
          },
          {
            "path": "libs/infinity_emb/infinity_emb/transformer/embedder/optimum.py"
          },
          {
            "path": "libs/infinity_emb/infinity_emb/transformer/utils_optimum.py"
          },
          {
            "path": "libs/infinity_emb/tests/unit_test/transformer/embedder/test_optimum.py"
          }
        ],
        "runId": "run-2026-02-27-14-42-59",
        "headSha": "4bf797adb84dcc31f23bc853dc0b1e3072c76c85"
      }
    },
    {
      "op": "replace",
      "path": "/stakeholderNotes/data-engineer/changes",
      "value": "- Updated container build configuration for embeddings in libs/infinity_emb/Docker.template.yaml and CPU/Intel auto Dockerfiles, likely affecting how embedding services are packaged and deployed.\n- Adjusted optional dependency handling in libs/infinity_emb/infinity_emb/_optional_imports.py, which may change when extra libraries (e.g., Optimum) are required vs. optional.\n- Modified embedding primitives in libs/infinity_emb/infinity_emb/primitives.py, potentially impacting the public embedding API or behavior.\n- Updated Optimum-based embedder implementation and utilities in libs/infinity_emb/infinity_emb/transformer/embedder/optimum.py and .../utils_optimum.py, which may affect supported model types or runtime performance.\n- Extended or revised unit tests in libs/infinity_emb/tests/unit_test"
    },
    {
      "op": "replace",
      "path": "/stakeholderNotes/data-engineer/confidence",
      "value": 0.1
    },
    {
      "op": "replace",
      "path": "/stakeholderNotes/data-engineer/overview",
      "value": "This component provides transformer-based text embedding capabilities (e.g., via Optimum-backed models) that can be containerized and deployed through the project’s Docker images. It is primarily consumed by programmatic clients (Python) that need efficient embedding generation for downstream ML workflows, such as retrieval and similarity search. Relevant stakeholder groups appear to be captured under $.business.userPopulations ⚠️, with the overall card identified by $.meta.title ⚠️. Operational and review history is tracked in $.provenance.changelog[1] ⚠️."
    },
    {
      "op": "replace",
      "path": "/stakeholderNotes/data-scientist/changes",